BK BLT - Burger King,Burger King,http://hackthemenu.com/burger-king/secret-menu/bk-blt/,The Burger King BLT burger is one of Burger King's most famous "secret menu" items for those looking for a twist on a classic meal. The BK BLT Burger is simply a Whopper or Whopper Junior topped with delicious bacon. How delicious does that sound? So, if you are tired of the basic Whopper, try a BK BLT burger from secret menu. In our opinion, the BK BLT burger is a nice little meal that gives a lively twist on the classic bacon, lettuce, & tomato sandwich. When ordering, don't forget to grab a drink with your BK BLT to wash it down! Be sure to check out the Burger King Secret Menu as well as visiting our home page to check out the complete list of All secret Menus from all your favorite restaurants!,http://hackthemenu.com/wp-content/uploads/2013/07/burger-king-bk-blt.jpg,All Locations,Classic BLT Toppings added to a Whopper or Whopper Jr.,Toppings, Whopper,4,$1.79 Whopper Jr., $3.49 Whopper,Ask for extra Bacon to be added to your Whopper or Whopper Jr.
BK Club - Burger King,Burger King,http://hackthemenu.com/burger-king/secret-menu/bk-club/,The Burger King "BK Club" from the BK secret menu when a Chicken Sandwich is too plain for your tastes. Hidden on the Burger King secret menu is this BK Club sandwich that is made to imitate a chicken club sandwich. As you can probably imagine, this BK secret menu item is the deliciously crispy chicken sandwich topped with mouth-watering bacon, tomato, and cheese. Can't wait to try it yet? Hitch a ride over to your closest Burger King and grab the BK Club off their secret menu. Treat yourself to a BK Club and just sit back and enjoy this delicious masterpiece. The Burger King Secret Menu may not be as well known as others, but it sure has some delicious creations! Be sure to check out the Burger King Secret Menu as well as visiting our home page to check out the complete list of All secret Menus from all your favorite restaurants!,http://hackthemenu.com/wp-content/uploads/2013/07/burger-king-bk-club.jpg,All Locations,Extra Bacon, Tomato, & Cheese on a Chicken Sandwich,Bacon, Tomato, Cheese, Chicken Sandwich,4,$3.99,Simply ask for an Original Chicken Sandwich with added bacon, tomato, & cheese. Now you've got yourself the famous BK Club!
BK Ham and Cheese - Burger King,Burger King,http://hackthemenu.com/burger-king/secret-menu/bk-ham-and-cheese/,The Burger King Ham and Cheese sandwich is one of the most distinguished BK "secret menu" items for those looking for something a litte diffferent when out at a fast food burger restaurant. The Burger King Ham and Cheese is a classic Ham & Cheese sandwich on Burger King's signature bun. Is your mouth watering yet? If so, no need to worry. Go out and get yourself a Burger King Ham and Cheese right now! In our opinion, the Burger King Ham and Cheese is a refreshing sandwich in a land ruled by the King of the Burger. When ordering, don't forget to grab a drink to wash it down! Be sure to check out the Burger King Secret Menu as well as visiting our home page to check out the complete list of All secret Menus from all your favorite restaurants!,http://hackthemenu.com/wp-content/uploads/2013/07/burger-king-ham-and-cheese.jpg,All Locations,Ham & Cheese on a Sesame Seed Bun,Ham, Cheese, Sesame Seed Bun,6,$1.99,Simply ask for Ham & Cheese on a Bun of your choice (ex. Sesame) from the Burger King Secret Menu!
Black Eye - Starbucks,Starbucks,http://hackthemenu.com/starbucks/secret-menu/black-eye/,The Starbucks "Black Eye" from the Starbucks Secret Menu is a regular coffee (which can be ordered either iced or hot) with TWO shots of Espresso added. This drink is the middle ground between the less-caffeinated Red Eye and the super-caffeinated Green Eye . We guess that the Green Eye means "go, go, go" because that's all you're going to be doing with that much caffeine flowing through your veins. The Black Eye is slightly less, and probably a little better for your health. So, hey, if your body is really in need of caffeine, grab a Red / Black / Green Eye. Be sure to check out the Starbucks Secret Menu as well as visiting our home page to check out the complete list of All secret Menus from all your favorite restaurants!,http://hackthemenu.com/wp-content/uploads/2013/08/starbucks-22.jpg,All Locations,Regular Drip Coffee (Americano) plus 2 Espresso shots,Drip Coffee, Espresso shots,6,Normally priced, Varies by Size,Ask your barista for a "Black Eye" from the Starbucks secret menu. If they don't know secret recipe, then you can show them this secret recipe!
Blue-Topia - Jamba Juice,Jamba Juice,http://hackthemenu.com/jamba-juice/secret-menu/blue-topia/,The Jamba Juice "Blue-Topia" Smoothie is a very blue Jamba Juice Secret Menu Smoothies. In addition to the standard list of Jamba Juice smoothies, Jamba Juice has the Blue-Topia Smoothie which absolutely loaded with blueberries and blueberry juice. So, if you like the taste of blueberries, no, live for blueberries, then this smoothie has got your name written all over it! You must get yourself a Blue-Topia Smoothie from the Jamba Juice secret menu today. The Blue-Topia is something special. Be sure to check out the Jamba Juice Secret Menu as well as visiting our home page to check out the complete list of All secret Menus from all your favorite restaurants!,http://hackthemenu.com/wp-content/uploads/2013/08/jamba-juice-blue-topia.jpg,All Locations,Blueberry JuiceNon-Fat Frozen YogurtSoy MilkBlueberriesIce,Blueberry Juice, Non-Fat Frozen Yogurt, Soy Milk, Blueberry, Ice,4,Varies by Size,Ask if they know how to make the Berry Lime Sublime Smoothie. If not, show them secret Recipe from this page and they will be happy to make it for you!
Blueberry Cheesecake Milkshake - Chick-fil-A,Chick-fil-A,http://hackthemenu.com/chick-fil-a/secret-menu/blueberry-cheesecake-milkshake/,The "Blueberry Cheesecake Milkshake" is one of Chick-fil-A's most delicious "secret menu" items. So, if you're in the mood to really splurge - on both taste and calories - grab a straw and order the "blueberry cheesecake milkshake" at Chick-fil-A. Or better yet, grab a couple of straws and share this bad boy with your sweetie. If you've ever tried one of Chick-fil-A's milkshakes, in any flavor, you already know how rich and creamy they are, but this new flavor goes to a whole new level of rich and creamy... almost into dreamy! Be sure to check out the Chick-fil-A Secret Menu as well as visiting our home page to check out the complete list of All secret Menus from all your favorite restaurants!,http://hackthemenu.com/wp-content/uploads/2013/08/chick-fil-a-blueberry-chees.jpg,Limited Locations, Not available at most locations,A Blueberry Cheesecake Slice blended into a Vanilla Milkshake,Blueberry Cheesecake, Vanilla Milkshake,4,Varies by Location,Simply ask them if they can blend a piece of blueberry cheesecake into a vanilla milkshake for you.
Buffalo Chicken Sandwich - Chick-fil-A,Chick-fil-A,http://hackthemenu.com/chick-fil-a/secret-menu/buffalo-chicken-sandwich/,The "Buffalo Chicken Sandwich" is one of Chick-fil-A's more hushed "secret menu" items. This sandwich combines the spicy chicken sandwich with a red fire spiced sauce reminiscent of buffalo chicken wing sauce. It's actually like a giant boneless Buffalo "wing" on a bun. The patty actually remains nice and crunchy like the original but the Buffalo sauce adds a deceptively lasting heat to the sandwich. The sandwich actually didn't seem that spicy initially, but once it hits you're left with a slow burn! So, if the spicy chicken sandwich isn't hot enough for you, just ask for the "Buffalo Chicken Sandwich" next time you visit Chick-fil-A. Be sure to check out the Chick-fil-A Secret Menu as well as visiting our home page to check out the complete list of All secret Menus from all your favorite restaurants!,http://hackthemenu.com/wp-content/uploads/2013/08/chick-fil-a-buffalo-chicken.jpg,All Locations,Buffalo Sauce added to the Spicy Chicken Sandwich,Buffalo Sauce, Spicy Chicken Sandwich,2,$3.49,Simply ask for Buffalo Sauce on your Spicy Chicken Sandwich to create the "Buffalo Chicken Sandwich".
Build-Your-Own Bowl - KFC,KFC,http://hackthemenu.com/kfc/secret-menu/build-your-own-bowl/,The KFC build-your-own bowl ... Don't see a KFC bowl that pleases you? Thank goodness at KFC you can "build-your-own-bowl" off secret menu! With the KFC Build-Your-Own-Bowl option you can certainly get creative. When constructing your KFC build-your-own-bowl , you can add virtually anything on KFC's menu right into a bowl for a one-of-a-kind very personal bowl. Try layering your bowl with french fries and covering with gravy, cheese and of course - mashed potatoes and fried chicken! This customization really makes the KFC build-your-own bowl a great option at the KFC fast food chain. This secret menu option isn't ready until you are. Be sure to check out the KFC Secret Menu as well as visiting our home page to check out the complete list of All secret Menus from all your favorite restaurants!,http://hackthemenu.com/wp-content/uploads/2013/08/kfc-build-your-own-bowl.jpg,Most Locations,Design your own dream KFC Bowl with all your favorite toppings!,Anything,4,Normally priced,Ask them if you can customize your own Bowl. If they let you, then just tell them what you want.
Burritodilla - Chipotle,Chipotle,http://hackthemenu.com/chipotle/secret-menu/burritodilla/,Meet the Burritodilla from the Chipotle secret menu, a crunchy, gooey, and incredibly delicious combination of a burrito and quesadilla. The Burritodilla is a smaller, more diet friendly alteration of the Chipotle Quesarito that allows the consumer to eat without the mess of a behemoth burrito. secret to the Burritodilla is that it's essentially a Chipotle Quesadilla (also on secret menu), except only half the fillings of a regular burrito are sandwiched between heaping handfuls of cheese. This glorious mash-up of Chipotle cuisine is then grilled to a perfect crunch. It's an amazing hybrid between a stuffed, flavorful burrito and a straightforward quesadilla. howToOrder The Chipotle Burritodilla: If the server is not aware of secret recipe, have them place a handful of cheese on one side of the burrito and order about half the amount of fillings of a regular burrito on-top of that cheese. Next, they will place another handful of cheese on-top of the fillings, fold it in half and place it in the giant warmer for a few minutes. Next step, enjoy! Be sure to check out the Chipotle Secret Menu as well as visiting our home page to check out the complete list of All secret Menus from all your favorite restaurants!,http://hackthemenu.com/wp-content/uploads/2014/02/chipotle-burritodilla.jpg,All Locations,,,6,$4.99 + Sides,Ask for a burrito to be grilled up like a quesadilla. Make sure to ask for half the amount of fillings so it doesn't overflow!
Butterbeer Frappuccino - Starbucks,Starbucks,http://hackthemenu.com/starbucks/secret-menu/butterbeer-frappuccino/,The "Starbucks Butterbeer Frappuccino" is a testament to how influential a story such as Harry Potter can be as it inspired the creation of one of the special Starbucks Secret Menu Frappuccinos . The fans wanted a drink that could bring them into the world of Harry Potter. Thus, the Butterbeer Frappucino was created in all of its glory and brought to the Starbucks secret menu. The Strabucks Butterbeer Frappuccino is a Toffee Nut & Caramel Creme Frappuccino that mimics the Butterbeer from Harry Potter. Make sure to check out this and all the other Starbucks Secret Menu Drinks at 